student@student-OptiPlex-3050:~$ sudo mysql -u root -p
[sudo] password for student: 
Enter password: 
Welcome to the MariaDB monitor.  Commands end with ; or \g.
Your MariaDB connection id is 32
Server version: 10.0.38-MariaDB-0ubuntu0.16.04.1 Ubuntu 16.04

Copyright (c) 2000, 2018, Oracle, MariaDB Corporation Ab and others.

Type 'help;' or '\h' for help. Type '\c' to clear the current input statement.

MariaDB [(none)]> show databases;
+--------------------+
| Database           |
+--------------------+
| db1                |
| information_schema |
| mysql              |
| performance_schema |
+--------------------+
4 rows in set (0.01 sec)

MariaDB [(none)]> use db1;
Reading table information for completion of table and column names
You can turn off this feature to get a quicker startup with -A
Database changed

MariaDB [db1]> create table clientmaster(clientno varchar(20),name varchar(20),address varchar(20),city varchar(20),pincode int,state varchar(20));
Query OK, 0 rows affected (0.23 sec)

MariaDB [db1]> insert into clientmaster values('c0190','Wolski','Filtrowa','Helsinki',21240,'Finland');
Query OK, 1 row affected (0.04 sec)

riaDB [db1]> insert into clientmaster values('c0111','Kester','Cherryhills','Columbia',12468,'USA');
Query OK, 1 row affected (0.03 sec)

MariaDB [db1]> insert into clientmaster values('c0205','Jaya','Ponath','Trissur',683012,'Kerala');
Query OK, 1 row affected (0.03 sec)

MariaDB [db1]> insert into clientmaster values('c2000','Rani','Greenvilla','Bangalore',560001,'Karnataka');
Query OK, 1 row affected (0.04 sec)

MariaDB [db1]> insert into clientmaster values('c0107','Vishnu','Puthiyaveedu','Kochi',683501,'Kerala');
Query OK, 1 row affected (0.04 sec)

MariaDB [db1]> insert into clientmaster values('c0200','Jaya','Jeevantara','Sansadmarg',110001,'Delhi');
Query OK, 1 row affected (0.04 sec)

MariaDB [db1]> select * from clientmaster;
+----------+--------+--------------+------------+---------+-----------+
| clientno | name   | address      | city       | pincode | state     |
+----------+--------+--------------+------------+---------+-----------+
| c0190    | Wolski | Filtrowa     | Helsinki   |   21240 | Finland   |
| c0111    | Kester | Cherryhills  | Columbia   |   12468 | USA       |
| c0205    | Jaya   | Ponath       | Trissur    |  683012 | Kerala    |
| c2000    | Rani   | Greenvilla   | Bangalore  |  560001 | Karnataka |
| c0107    | Vishnu | Puthiyaveedu | Kochi      |  683501 | Kerala    |
| c0200    | Jaya   | Jeevantara   | Sansadmarg |  110001 | Delhi     |
+----------+--------+--------------+------------+---------+-----------+
6 rows in set (0.00 sec)


MariaDB [db1]> select clientno,name from clientmaster;
+----------+--------+
| clientno | name   |
+----------+--------+
| c0190    | Wolski |
| c0111    | Kester |
| c0205    | Jaya   |
| c2000    | Rani   |
| c0107    | Vishnu |
| c0200    | Jaya   |
+----------+--------+

MariaDB [db1]> select distinct name from clientmaster;
+--------+
| name   |
+--------+
| Wolski |
| Kester |
| Jaya   |
| Rani   |
| Vishnu |
+--------+
5 rows in set (0.00 sec)

MariaDB [db1]> select clientno,name,address,city from clientmaster order by name asc;

+----------+--------+--------------+------------+
| clientno | name   | address      | city       |
+----------+--------+--------------+------------+
| c0205    | Jaya   | Ponath       | Trissur    |
| c0200    | Jaya   | Jeevantara   | Sansadmarg |
| c0111    | Kester | Cherryhills  | Columbia   |
| c2000    | Rani   | Greenvilla   | Bangalore  |
| c0107    | Vishnu | Puthiyaveedu | Kochi      |
| c0190    | Wolski | Filtrowa     | Helsinki   |
+----------+--------+--------------+------------+

MariaDB [db1]> select clientno,name,address,city from clientmaster order by name desc;
+----------+--------+--------------+------------+
| clientno | name   | address      | city       |
+----------+--------+--------------+------------+
| c0190    | Wolski | Filtrowa     | Helsinki   |
| c0107    | Vishnu | Puthiyaveedu | Kochi      |
| c2000    | Rani   | Greenvilla   | Bangalore  |
| c0111    | Kester | Cherryhills  | Columbia   |
| c0205    | Jaya   | Ponath       | Trissur    |
| c0200    | Jaya   | Jeevantara   | Sansadmarg |
+----------+--------+--------------+------------+
6 rows in set (0.00 sec)


MariaDB [db1]> select clientno,name from clientmaster where clientno='c0200';
+----------+------+
| clientno | name |
+----------+------+
| c0200    | Jaya |
+----------+------+
1 row in set (0.00 sec)

MariaDB [db1]> alter table clientmaster add telephone int(10);
Query OK, 0 rows affected (0.58 sec)
Records: 0  Duplicates: 0  Warnings: 0

MariaDB [db1]>  update clientmaster set telephone=001145678,faxno=8048 where clientno='c0190';
Query OK, 1 row affected (0.04 sec)
Rows matched: 1  Changed: 1  Warnings: 0

MariaDB [db1]>  update clientmaster set telephone=0011408127,faxno=00111 where clientno='c0111';
Query OK, 1 row affected (0.04 sec)
Rows matched: 1  Changed: 1  Warnings: 0

MariaDB [db1]>  update clientmaster set telephone=0484240789,faxno=2312 where clientno='c0205';
Query OK, 1 row affected (0.04 sec)
Rows matched: 1  Changed: 1  Warnings: 0

MariaDB [db1]>  update clientmaster set telephone=90943215,faxno=90089 where clientno='c2000';
Query OK, 1 row affected (0.03 sec)
Rows matched: 1  Changed: 1  Warnings: 0

MariaDB [db1]>  update clientmaster set telephone=940921286,faxno=600124 where clientno='c0107';
Query OK, 1 row affected (0.03 sec)
Rows matched: 1  Changed: 1  Warnings: 0

MariaDB [db1]>  update clientmaster set telephone=94089621,faxno=41247 where clientno='c0200';
Query OK, 1 row affected (0.03 sec)
Rows matched: 1  Changed: 1  Warnings: 0

MariaDB [db1]> select * from clientmaster;
+----------+--------+--------------+------------+---------+-----------+-----------+--------+
| clientno | name   | address      | city       | pincode | state     | telephone | faxno  |
+----------+--------+--------------+------------+---------+-----------+-----------+--------+
| c0190    | Wolski | Filtrowa     | Helsinki   |   21240 | Finland   |   1145678 |   8048 |
| c0111    | Kester | Cherryhills  | Columbia   |   12468 | USA       |  11408127 |    111 |
| c0205    | Jaya   | Ponath       | Trissur    |  683012 | Kerala    | 484240789 |   2312 |
| c2000    | Rani   | Greenvilla   | Bangalore  |  560001 | Karnataka |  90943215 |  90089 |
| c0107    | Vishnu | Puthiyaveedu | Kochi      |  683501 | Kerala    | 940921286 | 600124 |
| c0200    | Jaya   | Jeevantara   | Sansadmarg |  110001 | Delhi     |  94089621 |  41247 |
+----------+--------+--------------+------------+---------+-----------+-----------+--------+
6 rows in set (0.00 sec)

MariaDB [db1]> alter table clientmaster modify faxno varchar(20);
Query OK, 0 rows affected (0.00 sec)
Records: 0  Duplicates: 0  Warnings: 0

MariaDB [db1]> desc clientmaster;
+-----------+-------------+------+-----+---------+-------+
| Field     | Type        | Null | Key | Default | Extra |
+-----------+-------------+------+-----+---------+-------+
| clientno  | varchar(20) | YES  |     | NULL    |       |
| name      | varchar(20) | YES  |     | NULL    |       |
| address   | varchar(20) | YES  |     | NULL    |       |
| city      | varchar(20) | YES  |     | NULL    |       |
| pincode   | int(11)     | YES  |     | NULL    |       |
| state     | varchar(20) | YES  |     | NULL    |       |
| telephone | varchar(20) | YES  |     | NULL    |       |
| faxno     | varchar(20) | YES  |     | NULL    |       |
+-----------+-------------+------+-----+---------+-------+
8 rows in set (0.00 sec)

MariaDB [db1]> drop table clientmaster;
Query OK, 0 rows affected (0.11 sec)







