$ sudo mysql -u root -p
[sudo] password for student: 
Enter password: 
Welcome to the MariaDB monitor.  Commands end with ; or \g.
Your MariaDB connection id is 33
Server version: 10.0.38-MariaDB-0ubuntu0.16.04.1 Ubuntu 16.04

Copyright (c) 2000, 2018, Oracle, MariaDB Corporation Ab and others.

Type 'help;' or '\h' for help. Type '\c' to clear the current input statement.

MariaDB [(none)]> show databases;
+--------------------+
| Database           |
+--------------------+
| db1                |
| db2                |
| db3                |
| information_schema |
| mysql              |
| performance_schema |
+--------------------+
6 rows in set (0.03 sec)

MariaDB [(none)]> use db1;
Reading table information for completion of table and column names
You can turn off this feature to get a quicker startup with -A

Database changed
MariaDB [db1]> create table jobs(job_id int primary key,job_title varchar(25),min_salary int,max_salary int);
Query OK, 0 rows affected (0.24 sec)

MariaDB [db1]> select * from jobs;
Empty set (0.00 sec)

MariaDB [db1]> insert into jobs values(100,"Developer",10000,30000);
Query OK, 1 row affected (0.03 sec)

MariaDB [db1]> insert into jobs values(101,"Designer",15000,35000);
Query OK, 1 row affected (0.04 sec)

MariaDB [db1]> insert into jobs values(102,"Manager",30000,50000);
Query OK, 1 row affected (0.02 sec)

MariaDB [db1]> insert into jobs values(103,"HR",35000,40000);
Query OK, 1 row affected (0.04 sec)

MariaDB [db1]> select * from jobs;
+--------+-----------+------------+------------+
| job_id | job_title | min_salary | max_salary |
+--------+-----------+------------+------------+
|    100 | Developer |      10000 |      30000 |
|    101 | Designer  |      15000 |      35000 |
|    102 | Manager   |      30000 |      50000 |
|    103 | HR        |      35000 |      40000 |
+--------+-----------+------------+------------+
4 rows in set (0.00 sec)

MariaDB [db1]> create table employees(employee_id int primary key,first_name varchar(10),last_name varchar(10),email varchar(20),phone_number long,hire_date date,job_id int references jobs,salary int,manager_id int,department_id int references departments);
Query OK, 0 rows affected (0.26 sec)

MariaDB [db1]> create table departments(department_id int primary key,department_name varchar(10));
Query OK, 0 rows affected (0.20 sec)

MariaDB [db1]> desc jobs;
+------------+-------------+------+-----+---------+-------+
| Field      | Type        | Null | Key | Default | Extra |
+------------+-------------+------+-----+---------+-------+
| job_id     | int(11)     | NO   | PRI | NULL    |       |
| job_title  | varchar(25) | YES  |     | NULL    |       |
| min_salary | int(11)     | YES  |     | NULL    |       |
| max_salary | int(11)     | YES  |     | NULL    |       |
+------------+-------------+------+-----+---------+-------+
4 rows in set (0.03 sec)

MariaDB [db1]> desc departments;
+-----------------+-------------+------+-----+---------+-------+
| Field           | Type        | Null | Key | Default | Extra |
+-----------------+-------------+------+-----+---------+-------+
| department_id   | int(11)     | NO   | PRI | NULL    |       |
| department_name | varchar(10) | YES  |     | NULL    |       |
+-----------------+-------------+------+-----+---------+-------+
2 rows in set (0.00 sec)

MariaDB [db1]> desc employees;
+---------------+-------------+------+-----+---------+-------+
| Field         | Type        | Null | Key | Default | Extra |
+---------------+-------------+------+-----+---------+-------+
| employee_id   | int(11)     | NO   | PRI | NULL    |       |
| first_name    | varchar(10) | YES  |     | NULL    |       |
| last_name     | varchar(10) | YES  |     | NULL    |       |
| email         | varchar(20) | YES  |     | NULL    |       |
| phone_number  | mediumtext  | YES  |     | NULL    |       |
| hire_date     | date        | YES  |     | NULL    |       |
| job_id        | int(11)     | YES  |     | NULL    |       |
| salary        | int(11)     | YES  |     | NULL    |       |
| manager_id    | int(11)     | YES  |     | NULL    |       |
| department_id | int(11)     | YES  |     | NULL    |       |
+---------------+-------------+------+-----+---------+-------+
10 rows in set (0.00 sec)


MariaDB [db1]> insert into departments values(201,"Accounts");
Query OK, 1 row affected (0.03 sec)

MariaDB [db1]> insert into departments values(201,"Sales");
ERROR 1062 (23000): Duplicate entry '201' for key 'PRIMARY'
MariaDB [db1]> insert into departments values(202,"Sales");
Query OK, 1 row affected (0.03 sec)

MariaDB [db1]> insert into departments values(203,"Technical");
Query OK, 1 row affected (0.02 sec)

MariaDB [db1]> insert into departments values(204,"Development");
Query OK, 1 row affected, 1 warning (0.03 sec)

MariaDB [db1]> select * from departments;
+---------------+-----------------+
| department_id | department_name |
+---------------+-----------------+
|           201 | Accounts        |
|           202 | Sales           |
|           203 | Technical       |
|           204 | Developmen      |
+---------------+-----------------+
4 rows in set (0.00 sec)

MariaDB [db1]> insert into employees values(1,'John','White','johnwhite@yahoo.com',001253654,1993/02/01,100,15000,10,204);
Query OK, 1 row affected, 1 warning (0.04 sec)

MariaDB [db1]> insert into employees values(2,'Martha','Susan','marthasusan@yahoo.com',008953654,1995/12/31,101,30000,20,204);
Query OK, 1 row affected, 2 warnings (0.03 sec)

MariaDB [db1]> insert into employees values(3,'Tom','patric','patrictom@gmail.com',00245872,1991/11/3,102,40000,30,203);
Query OK, 1 row affected, 1 warning (0.04 sec)

MariaDB [db1]> insert into employees values(4,'Maria','Jose','mariaj@gmail.com',0023585872,1994/11/13,103,36000,40,202);
Query OK, 1 row affected, 1 warning (0.03 sec)

MariaDB [db1]> insert into employees values(5,'Ronald','Roy','ronaldroy@gmail.com',0013253694,1995/08/2,102,36000,50,201);
Query OK, 1 row affected, 1 warning (0.03 sec)

MariaDB [db1]> select * from employees;
+-------------+------------+-----------+----------------------+--------------+------------+--------+--------+------------+---------------+
| employee_id | first_name | last_name | email                | phone_number | hire_date  | job_id | salary | manager_id | department_id |
+-------------+------------+-----------+----------------------+--------------+------------+--------+--------+------------+---------------+
|           1 | John       | White     | johnwhite@yahoo.com  | 1253654      | 0000-00-00 |    100 |  15000 |         10 |           204 |
|           2 | Martha     | Susan     | marthasusan@yahoo.co | 8953654      | 0000-00-00 |    101 |  30000 |         20 |           204 |
|           3 | Tom        | patric    | patrictom@gmail.com  | 245872       | 0000-00-00 |    102 |  40000 |         30 |           203 |
|           4 | Maria      | Jose      | mariaj@gmail.com     | 23585872     | 0000-00-00 |    103 |  36000 |         40 |           202 |
|           5 | Ronald     | Roy       | ronaldroy@gmail.com  | 13253694     | 2000-01-24 |    102 |  36000 |         50 |           201 |
+-------------+------------+-----------+----------------------+--------------+------------+--------+--------+------------+---------------+
5 rows in set (0.00 sec)

MariaDB [db1]> MariaDB [db1]> update employee set hire_date='1993/02/01' where employee_id=1;
ERROR 1054 (42S22): Unknown column 'employee_id' in 'where clause'
MariaDB [db1]> update employees set hire_date='1993/02/01' where employee_id=1;
Query OK, 1 row affected (0.05 sec)
Rows matched: 1  Changed: 1  Warnings: 0

MariaDB [db1]> update employees set hire_date='1995/12/31' where employee_id=2;
Query OK, 1 row affected (0.03 sec)
Rows matched: 1  Changed: 1  Warnings: 0

MariaDB [db1]> update employees set hire_date='1991/11/3' where employee_id=3;
Query OK, 1 row affected (0.03 sec)
Rows matched: 1  Changed: 1  Warnings: 0

MariaDB [db1]> update employees set hire_date='1994/11/13' where employee_id=4;
Query OK, 1 row affected (0.03 sec)
Rows matched: 1  Changed: 1  Warnings: 0

MariaDB [db1]> update employees set hire_date='1995/08/2' where employee_id=5;
Query OK, 1 row affected (0.02 sec)
Rows matched: 1  Changed: 1  Warnings: 0

MariaDB [db1]> select * from employees;
+-------------+------------+-----------+----------------------+--------------+------------+--------+--------+------------+---------------+
| employee_id | first_name | last_name | email                | phone_number | hire_date  | job_id | salary | manager_id | department_id |
+-------------+------------+-----------+----------------------+--------------+------------+--------+--------+------------+---------------+
|           1 | John       | White     | johnwhite@yahoo.com  | 1253654      | 1993-02-01 |    100 |  15000 |         10 |           204 |
|           2 | Martha     | Susan     | marthasusan@yahoo.co | 8953654      | 1995-12-31 |    101 |  30000 |         20 |           204 |
|           3 | Tom        | patric    | patrictom@gmail.com  | 245872       | 1991-11-03 |    102 |  40000 |         30 |           203 |
|           4 | Maria      | Jose      | mariaj@gmail.com     | 23585872     | 1994-11-13 |    103 |  36000 |         40 |           202 |
|           5 | Ronald     | Roy       | ronaldroy@gmail.com  | 13253694     | 1995-08-02 |    102 |  36000 |         50 |           201 |
+-------------+------------+-----------+----------------------+--------------+------------+--------+--------+------------+---------------+
5 rows in set (0.00 sec)

MariaDB [db1]> alter table departments to dept;
ERROR 1064 (42000): You have an error in your SQL syntax; check the manual that corresponds to your MariaDB server version for the right syntax to use near 'to dept' at line 1
MariaDB [db1]> alter table departments rename to dept;
Query OK, 0 rows affected (0.08 sec)

MariaDB [db1]> selct * from dept;
ERROR 1064 (42000): You have an error in your SQL syntax; check the manual that corresponds to your MariaDB server version for the right syntax to use near 'selct * from dept' at line 1
MariaDB [db1]> select * from dept;
+---------------+-----------------+
| department_id | department_name |
+---------------+-----------------+
|           201 | Accounts        |
|           202 | Sales           |
|           203 | Technical       |
|           204 | Developmen      |
+---------------+-----------------+
4 rows in set (0.00 sec)

MariaDB [db1]> alter table employees modify salary smallint;
Query OK, 5 rows affected, 3 warnings (0.64 sec)   
Records: 5  Duplicates: 0  Warnings: 3

MariaDB [db1]> desc employees;
+---------------+-------------+------+-----+---------+-------+
| Field         | Type        | Null | Key | Default | Extra |
+---------------+-------------+------+-----+---------+-------+
| employee_id   | int(11)     | NO   | PRI | NULL    |       |
| first_name    | varchar(10) | YES  |     | NULL    |       |
| last_name     | varchar(10) | YES  |     | NULL    |       |
| email         | varchar(20) | YES  |     | NULL    |       |
| phone_number  | mediumtext  | YES  |     | NULL    |       |
| hire_date     | date        | YES  |     | NULL    |       |
| job_id        | int(11)     | YES  |     | NULL    |       |
| salary        | smallint(6) | YES  |     | NULL    |       |
| manager_id    | int(11)     | YES  |     | NULL    |       |
| department_id | int(11)     | YES  |     | NULL    |       |
+---------------+-------------+------+-----+---------+-------+
10 rows in set (0.00 sec)

MariaDB [db1]> ariaDB [db1]> desc employees;
+---------------+-------------+------+-----+---------+-------+
| Field         | Type        | Null | Key | Default | Extra |
+---------------+-------------+------+-----+---------+-------+
| employee_id   | int(11)     | NO   | PRI | NULL    |       |
| first_name    | varchar(10) | YES  |     | NULL    |       |
| last_name     | varchar(10) | YES  |     | NULL    |       |
| email         | varchar(20) | YES  |     | NULL    |       |
| phone_number  | mediumtext  | YES  |     | NULL    |       |
| hire_date     | date        | YES  |     | NULL    |       |
| job_id        | int(11)     | YES  |     | NULL    |       |
| salary        | smallint(6) | YES  |     | NULL    |       |
| manager_id    | int(11)     | YES  |     | NULL    |       |
| department_id | int(11)     | YES  |     | NULL    |       |
+---------------+-------------+------+-----+---------+-------+
10 rows in set (0.00 sec)

MariaDB [db1]> alter table employees add commision varchar(20);
Query OK, 0 rows affected (0.37 sec)
Records: 0  Duplicates: 0  Warnings: 0

MariaDB [db1]> update table employees modify commision int;
ERROR 1064 (42000): You have an error in your SQL syntax; check the manual that corresponds to your MariaDB server version for the right syntax to use near 'table employees modify commision int' at line 1
MariaDB [db1]> alter table employees modify commision int;
Query OK, 5 rows affected (0.58 sec)               
Records: 5  Duplicates: 0  Warnings: 0


MariaDB [db1]> update employees set commision=1000 where employee_id=1;
Query OK, 1 row affected (0.03 sec)
Rows matched: 1  Changed: 1  Warnings: 0

MariaDB [db1]> update employees set commision=500 where employee_id=2;
Query OK, 1 row affected (0.03 sec)
Rows matched: 1  Changed: 1  Warnings: 0

MariaDB [db1]> update employees set commision=1500 where employee_id=3;
Query OK, 1 row affected (0.04 sec)
Rows matched: 1  Changed: 1  Warnings: 0

MariaDB [db1]> update employees set commision=1000 where employee_id=4;
Query OK, 1 row affected (0.03 sec)
Rows matched: 1  Changed: 1  Warnings: 0

MariaDB [db1]> update employees set commision=900 where employee_id=5;
Query OK, 1 row affected (0.03 sec)
Rows matched: 1  Changed: 1  Warnings: 0

MariaDB [db1]> select * from employees;
+-------------+------------+-----------+----------------------+--------------+------------+--------+--------+------------+---------------+-----------+
| employee_id | first_name | last_name | email                | phone_number | hire_date  | job_id | salary | manager_id | department_id | commision |
+-------------+------------+-----------+----------------------+--------------+------------+--------+--------+------------+---------------+-----------+
|           1 | John       | White     | johnwhite@yahoo.com  | 1253654      | 1993-02-01 |    100 |  15000 |         10 |           204 |      1000 |
|           2 | Martha     | Susan     | marthasusan@yahoo.co | 8953654      | 1995-12-31 |    101 |  30000 |         20 |           204 |       500 |
|           3 | Tom        | patric    | patrictom@gmail.com  | 245872       | 1991-11-03 |    102 |  32767 |         30 |           203 |      1500 |
|           4 | Maria      | Jose      | mariaj@gmail.com     | 23585872     | 1994-11-13 |    103 |  32767 |         40 |           202 |      1000 |
|           5 | Ronald     | Roy       | ronaldroy@gmail.com  | 13253694     | 1995-08-02 |    102 |  32767 |         50 |           201 |       900 |
+-------------+------------+-----------+----------------------+--------------+------------+--------+--------+------------+---------------+-----------+
5 rows in set (0.00 sec)

MariaDB [db1]> 
MariaDB [db1]> alter table employees drop hire_date;
Query OK, 0 rows affected (0.34 sec)
Records: 0  Duplicates: 0  Warnings: 0

MariaDB [db1]> select * from employees;
+-------------+------------+-----------+----------------------+--------------+--------+--------+------------+---------------+-----------+
| employee_id | first_name | last_name | email                | phone_number | job_id | salary | manager_id | department_id | commision |
+-------------+------------+-----------+----------------------+--------------+--------+--------+------------+---------------+-----------+
|           1 | John       | White     | johnwhite@yahoo.com  | 1253654      |    100 |  15000 |         10 |           204 |      1000 |
|           2 | Martha     | Susan     | marthasusan@yahoo.co | 8953654      |    101 |  30000 |         20 |           204 |       500 |
|           3 | Tom        | patric    | patrictom@gmail.com  | 245872       |    102 |  32767 |         30 |           203 |      1500 |
|           4 | Maria      | Jose      | mariaj@gmail.com     | 23585872     |    103 |  32767 |         40 |           202 |      1000 |
|           5 | Ronald     | Roy       | ronaldroy@gmail.com  | 13253694     |    102 |  32767 |         50 |           201 |       900 |
+-------------+------------+-----------+----------------------+--------------+--------+--------+------------+---------------+-----------+
5 rows in set (0.00 sec)
ariaDB [db1]> select * from employees;
+-------------+------------+-----------+----------------------+--------------+--------+--------+------------+---------------+-----------+
| employee_id | first_name | last_name | email                | phone_number | job_id | salary | manager_id | department_id | commision |
+-------------+------------+-----------+----------------------+--------------+--------+--------+------------+---------------+-----------+
|           1 | John       | White     | johnwhite@yahoo.com  | 1253654      |    100 |  15000 |         10 |           204 |      1000 |
|           2 | Martha     | Susan     | marthasusan@yahoo.co | 8953654      |    101 |  30000 |         20 |           204 |       500 |
|           3 | Tom        | patric    | patrictom@gmail.com  | 245872       |    102 |  32767 |         30 |           203 |      1500 |
|           5 | Ronald     | Roy       | ronaldroy@gmail.com  | 13253694     |    102 |  32767 |         50 |           201 |       900 |
+-------------+------------+-----------+----------------------+--------------+--------+--------+------------+---------------+-----------+
4 rows in set (0.00 sec)

MariaDB [db1]> 
MariaDB [db1]> truncate table employees;
Query OK, 0 rows affected (0.21 sec)

MariaDB [db1]> select * from employees;
Empty set (0.00 sec)

MariaDB [db1]> drop table employees;
Query OK, 0 rows affected (0.10 sec)

MariaDB [db1]> select * from employees;
ERROR 1146 (42S02): Table 'db1.employees' doesn't exist
MariaDB [db1]> 



